{
  "$schema": "https://json-schema.org/draft/2020-12/schema",
  "$id": "https://github.com/jamiemulcahy/pa-pedia/pkg/models/faction-profile",
  "$ref": "#/$defs/FactionProfile",
  "$defs": {
    "FactionProfile": {
      "properties": {
        "displayName": {
          "type": "string",
          "description": "Human-readable faction name (e.g. 'MLA' or 'Legion')"
        },
        "factionUnitType": {
          "type": "string",
          "description": "Faction unit type identifier (e.g. Custom58 for MLA or Custom1 for Legion)"
        },
        "isAddon": {
          "type": "boolean",
          "description": "True if this profile adds units to an existing base faction rather than defining a new one"
        },
        "mods": {
          "items": {
            "type": "string"
          },
          "type": "array",
          "description": "Mod identifiers that layer on base game in priority order (empty for base game only)"
        },
        "author": {
          "type": "string",
          "description": "Faction or profile author (auto-detected from primary mod if not specified)"
        },
        "description": {
          "type": "string",
          "description": "Brief description of the faction (auto-detected from primary mod if not specified)"
        },
        "version": {
          "type": "string",
          "description": "Semantic version (auto-detected from primary mod if not specified)"
        },
        "dateCreated": {
          "type": "string",
          "description": "ISO 8601 date (auto-detected from primary mod if not specified)"
        },
        "build": {
          "type": "string",
          "description": "PA game build number (auto-detected from primary mod if not specified)"
        },
        "backgroundImage": {
          "type": "string",
          "description": "Resource path to background image within mod sources (e.g. /ui/mods/my_mod/img/bg.png)"
        },
        "teamColors": {
          "$ref": "#/$defs/TeamColors",
          "description": "Default faction team-paint colour pair (primary/secondary hex) for the 3D model viewer"
        }
      },
      "additionalProperties": false,
      "type": "object",
      "required": [
        "displayName"
      ]
    },
    "TeamColors": {
      "properties": {
        "primary": {
          "type": "string",
          "description": "Default main/primary team colour as a hex string (e.g. #007cff)"
        },
        "secondary": {
          "type": "string",
          "description": "Default highlight/secondary team colour as a hex string (e.g. #ff6400)"
        }
      },
      "additionalProperties": false,
      "type": "object",
      "required": [
        "primary",
        "secondary"
      ]
    }
  },
  "title": "faction-profile"
}