{
  "displayName": "Bugs",
  "factionUnitType": "Custom2",
  "mods": ["com.pa.ferretmaster.bugs", "com.pa.ferretmaster.bugs-client"],
  "author": "Ferretmaster",
  "description": "The Bugs faction - adds a second fully playable faction with unique units",
  "backgroundImage": "ui/mods/bugs_faction/img/Bug_Menu.png"
}
